法规名称,法条号,内容,时效性,一级效力级别,二级效力级别,地域(含市),实施日期,失效日期,地域,详情链接,法条ID,法规ID,标签,相似度评分,类型
最高人民法院关于适用《中华人民共和国刑事诉讼法》的解释(2021),第二百六十条,　鉴定人、有专门知识的人、调查人员、侦查人员或者其他人员出庭的，参照适用前两条规定。,现行有效,司法解释,高法司法解释,中央,20210301,99999999,中央,https://ydzk.chineselaw.com/zxt/statuteDetail/detailPage/27f2a1c90daf9dce939acd155a8e1966?text=260,27f2a1c90daf9dce939acd155a8e1966_260,27f2a1c90daf9dce939acd155a8e1966,"['财税##司法及单行法律专题法规##法院', '财税##司法及单行法律专题法规', '财税']",1.1895867599999999,1
最高人民法院关于适用《中华人民共和国民事诉讼法》的解释(2022修正),第一百二十二条,"　当事人可以依照民事诉讼法第八十二条的规定，在举证期限届满前申请一至二名具有专门知识的人出庭，代表当事人对鉴定意见进行质证，或者对案件事实所涉及的专业问题提出意见。 
具有专门知识的人在法庭上就专业问题提出的意见，视为当事人的陈述。 
人民法院准许当事人申请的，相关费用由提出申请的当事人负担。",现行有效,司法解释,高法司法解释,中央,20220410,99999999,中央,https://ydzk.chineselaw.com/zxt/statuteDetail/detailPage/a8be8255398ec3a38327e8f07ecd18a0?text=122,a8be8255398ec3a38327e8f07ecd18a0_122,a8be8255398ec3a38327e8f07ecd18a0,"['财税##司法及单行法律专题法规##法院', '财税##司法及单行法律专题法规##民法典与民事诉讼法', '财税##司法及单行法律专题法规', '财税']",1.18400982,1
最高人民法院关于审理环境民事公益诉讼案件适用法律若干问题的解释(2020修正),第十五条,"　当事人申请通知有专门知识的人出庭，就鉴定人作出的鉴定意见或者就因果关系、生态环境修复方式、生态环境修复费用以及生态环境受到损害至修复完成期间服务功能丧失导致的损失等专门性问题提出意见的，人民法院可以准许。 
　　前款规定的专家意见经质证，可以作为认定事实的根据。",现行有效,司法解释,高法司法解释,中央,20210101,99999999,中央,https://ydzk.chineselaw.com/zxt/statuteDetail/detailPage/63ff5fc8f680a57011197cbd69f62e02?text=15,63ff5fc8f680a57011197cbd69f62e02_15,63ff5fc8f680a57011197cbd69f62e02,"['财税##司法及单行法律专题法规##法院', '财税##司法及单行法律专题法规', '财税']",1.18325316,1
最高人民法院关于民事诉讼证据的若干规定(2019修正),第八十三条,"　当事人依照民事诉讼法第七十九条和《最高人民法院关于适用〈中华人民共和国民事诉讼法〉的解释》第一百二十二条的规定，申请有专门知识的人出庭的，申请书中应当载明有专门知识的人的基本情况和申请的目的。 
　　人民法院准许当事人申请的，应当通知双方当事人。",现行有效,司法解释,高法司法解释,中央,20200501,99999999,中央,https://ydzk.chineselaw.com/zxt/statuteDetail/detailPage/21d0c4b7c7833b78c7217600f2be8693?text=83,21d0c4b7c7833b78c7217600f2be8693_83,21d0c4b7c7833b78c7217600f2be8693,"['财税##司法及单行法律专题法规##法院', '财税##司法及单行法律专题法规', '财税']",1.17820866,1
最高人民法院关于民事诉讼证据的若干规定(2019修正),第七十九条,"　鉴定人依照民事诉讼法第七十八条的规定出庭作证的，人民法院应当在开庭审理三日前将出庭的时间、地点及要求通知鉴定人。 
　　委托机构鉴定的，应当由从事鉴定的人员代表机构出庭。",现行有效,司法解释,高法司法解释,中央,20200501,99999999,中央,https://ydzk.chineselaw.com/zxt/statuteDetail/detailPage/21d0c4b7c7833b78c7217600f2be8693?text=79,21d0c4b7c7833b78c7217600f2be8693_79,21d0c4b7c7833b78c7217600f2be8693,"['财税##司法及单行法律专题法规##法院', '财税##司法及单行法律专题法规', '财税']",1.17162684,1
中华人民共和国刑事诉讼法(2018修正),第一百九十七条,"法庭审理过程中，当事人和辩护人、诉讼代理人有权申请通知新的证人到庭，调取新的物证，申请重新鉴定或者勘验。 
公诉人、当事人和辩护人、诉讼代理人可以申请法庭通知有专门知识的人出庭，就鉴定人作出的鉴定意见提出意见。 
法庭对于上述申请，应当作出是否同意的决定。 
第二款规定的有专门知识的人出庭，适用鉴定人的有关规定。",现行有效,法律,法律,中央,20181026,99999999,中央,https://ydzk.chineselaw.com/zxt/statuteDetail/detailPage/5187759def3ba263633f6ba6c37a91a3?text=197,5187759def3ba263633f6ba6c37a91a3_197,5187759def3ba263633f6ba6c37a91a3,"['财税##其他法律法规##其他法律', '财税##其他法律法规', '财税']",1.16938008,1
中华人民共和国民事诉讼法(2023修正),第八十二条,　当事人可以申请人民法院通知有专门知识的人出庭，就鉴定人作出的鉴定意见或者专业问题提出意见。,现行有效,法律,法律,中央,20240101,99999999,中央,https://ydzk.chineselaw.com/zxt/statuteDetail/detailPage/f1b65a4dca3d6472206978435e2ea215?text=82,f1b65a4dca3d6472206978435e2ea215_82,f1b65a4dca3d6472206978435e2ea215,"['企业法##纠纷解决', '财税##其他法律法规##其他法律', '财税##其他法律法规', '财税', '企业法', '上市公司法##民事责任', '上市公司法', '上市公司法##上市公司']",1.1683134,1
中华人民共和国民事诉讼法(2023修正),第八十一条,　当事人对鉴定意见有异议或者人民法院认为鉴定人有必要出庭的，鉴定人应当出庭作证。经人民法院通知，鉴定人拒不出庭作证的，鉴定意见不得作为认定事实的根据；支付鉴定费用的当事人可以要求返还鉴定费用。,现行有效,法律,法律,中央,20240101,99999999,中央,https://ydzk.chineselaw.com/zxt/statuteDetail/detailPage/f1b65a4dca3d6472206978435e2ea215?text=81,f1b65a4dca3d6472206978435e2ea215_81,f1b65a4dca3d6472206978435e2ea215,"['企业法##纠纷解决', '财税##其他法律法规##其他法律', '财税##其他法律法规', '财税', '企业法', '上市公司法##民事责任', '上市公司法', '上市公司法##上市公司']",1.1670231599999998,1
最高人民法院关于适用《中华人民共和国刑事诉讼法》的解释(2021),第二百五十条,"　公诉人、当事人及其辩护人、诉讼代理人申请法庭通知有专门知识的人出庭，就鉴定意见提出意见的，应当说明理由。法庭认为有必要的，应当通知有专门知识的人出庭。 
申请有专门知识的人出庭，不得超过二人。有多种类鉴定意见的，可以相应增加人数。",现行有效,司法解释,高法司法解释,中央,20210301,99999999,中央,https://ydzk.chineselaw.com/zxt/statuteDetail/detailPage/27f2a1c90daf9dce939acd155a8e1966?text=250,27f2a1c90daf9dce939acd155a8e1966_250,27f2a1c90daf9dce939acd155a8e1966,"['财税##司法及单行法律专题法规##法院', '财税##司法及单行法律专题法规', '财税']",1.163947968,1
最高人民法院关于行政诉讼证据若干问题的规定,第四十七条,"　当事人要求鉴定人出庭接受询问的，鉴定人应当出庭。鉴定人因正当事由不能出庭的，经法庭准许，可以不出庭，由当事人对其书面鉴定结论进行质证。 
　　鉴定人不能出庭的正当事由，参照本规定第四十一条的规定。 
　　对于出庭接受询问的鉴定人，法庭应当核实其身份、与当事人及案件的关系，并告知鉴定人如实说明鉴定情况的法律义务和故意作虚假说明的法律责任。",现行有效,司法解释,高法司法解释,中央,20021001,99999999,中央,https://ydzk.chineselaw.com/zxt/statuteDetail/detailPage/cec5dfff41c2a23b429b09bd95aa445e?text=47,cec5dfff41c2a23b429b09bd95aa445e_47,cec5dfff41c2a23b429b09bd95aa445e,[],1.1607442799999999,1
最高人民法院关于审理医疗损害责任纠纷案件适用法律若干问题的解释(2020修正),第十四条,"　当事人申请通知一至二名具有医学专门知识的人出庭，对鉴定意见或者案件的其他专门性事实问题提出意见，人民法院准许的，应当通知具有医学专门知识的人出庭。 
　　前款规定的具有医学专门知识的人提出的意见，视为当事人的陈述，经质证可以作为认定案件事实的根据。",现行有效,司法解释,高法司法解释,中央,20210101,99999999,中央,https://ydzk.chineselaw.com/zxt/statuteDetail/detailPage/5959af5e3f8c06e4fd9c071e0e0a7f7d?text=14,5959af5e3f8c06e4fd9c071e0e0a7f7d_14,5959af5e3f8c06e4fd9c071e0e0a7f7d,[],1.15144224,1
最高人民法院关于审理医疗损害责任纠纷案件适用法律若干问题的解释(2020修正),第十三条,"　鉴定意见应当经当事人质证。 
　　当事人申请鉴定人出庭作证，经人民法院审查同意，或者人民法院认为鉴定人有必要出庭的，应当通知鉴定人出庭作证。双方当事人同意鉴定人通过书面说明、视听传输技术或者视听资料等方式作证的，可以准许。 
　　鉴定人因健康原因、自然灾害等不可抗力或者其他正当理由不能按期出庭的，可以延期开庭；经人民法院许可，也可以通过书面说明、视听传输技术或者视听资料等方式作证。 
　　无前款规定理由，鉴定人拒绝出庭作证，当事人对鉴定意见又不认可的，对该鉴定意见不予采信。",现行有效,司法解释,高法司法解释,中央,20210101,99999999,中央,https://ydzk.chineselaw.com/zxt/statuteDetail/detailPage/5959af5e3f8c06e4fd9c071e0e0a7f7d?text=13,5959af5e3f8c06e4fd9c071e0e0a7f7d_13,5959af5e3f8c06e4fd9c071e0e0a7f7d,[],1.1467817519999999,1
人民法院对外委托司法鉴定管理规定,第十五条,　鉴定人应当依法履行出庭接受质询的义务。人民法院司法鉴定机构应当协调鉴定人做好出庭工作。,现行有效,司法解释,高法司法解释,中央,20020401,99999999,中央,https://ydzk.chineselaw.com/zxt/statuteDetail/detailPage/7ba9af83c410e2f6d3c1e70c3d002452?text=15,7ba9af83c410e2f6d3c1e70c3d002452_15,7ba9af83c410e2f6d3c1e70c3d002452,"['财税##司法及单行法律专题法规##法院', '财税##司法及单行法律专题法规', '财税']",1.1404931999999999,1
最高人民法院、司法部印发《关于开展刑事案件律师辩护全覆盖试点工作的办法》的通知,第十七条,　被告人、辩护律师申请法庭通知证人、鉴定人、有专门知识的人出庭作证的，法庭认为有必要的应当同意；法庭不同意的，应当书面向被告人及辩护律师说明理由。,现行有效,司法解释,司法解释性质文件,中央,20171009,99999999,中央,https://ydzk.chineselaw.com/zxt/statuteDetail/detailPage/4fe3b13c9ee0c56a3a28fefb2891b246?text=17,4fe3b13c9ee0c56a3a28fefb2891b246_17,4fe3b13c9ee0c56a3a28fefb2891b246,[],1.13176608,1
最高人民法院关于民事诉讼证据的若干规定(2019修正),第三十八条,"　当事人在收到鉴定人的书面答复后仍有异议的，人民法院应当根据《诉讼费用交纳办法》第十一条的规定，通知有异议的当事人预交鉴定人出庭费用，并通知鉴定人出庭。有异议的当事人不预交鉴定人出庭费用的，视为放弃异议。 
　　双方当事人对鉴定意见均有异议的，分摊预交鉴定人出庭费用。",现行有效,司法解释,高法司法解释,中央,20200501,99999999,中央,https://ydzk.chineselaw.com/zxt/statuteDetail/detailPage/21d0c4b7c7833b78c7217600f2be8693?text=38,21d0c4b7c7833b78c7217600f2be8693_38,21d0c4b7c7833b78c7217600f2be8693,"['财税##司法及单行法律专题法规##法院', '财税##司法及单行法律专题法规', '财税']",1.08292536,1
最高人民法院关于适用《中华人民共和国刑事诉讼法》的解释(2021),第九十九条,"　经人民法院通知，鉴定人拒不出庭作证的，鉴定意见不得作为定案的根据。 
鉴定人由于不能抗拒的原因或者有其他正当理由无法出庭的，人民法院可以根据情况决定延期审理或者重新鉴定。 
鉴定人无正当理由拒不出庭作证的，人民法院应当通报司法行政机关或者有关部门。",现行有效,司法解释,高法司法解释,中央,20210301,99999999,中央,https://ydzk.chineselaw.com/zxt/statuteDetail/detailPage/27f2a1c90daf9dce939acd155a8e1966?text=99,27f2a1c90daf9dce939acd155a8e1966_99,27f2a1c90daf9dce939acd155a8e1966,"['财税##司法及单行法律专题法规##法院', '财税##司法及单行法律专题法规', '财税']",1.033005312,1
最高人民检察院关于印发民事检察类案监督典型案例的通知,,本次类案监督意见在推进鉴定人出庭、强化鉴定意见实质审查、规范鉴定程序等方面与法院达成共识，有助于共同保障民事诉讼证据制度严格执行，促进审判职责全面履行，保护当事人合法权利，切实提升司法公信力。,现行有效,司法解释,指导案例,,20210927,99999999,中央,https://ydzk.chineselaw.com/zxt/statuteDetail/detailPage/b741c0699c09bfbd6694a05a544c62cc,,b741c0699c09bfbd6694a05a544c62cc,[],1.02293376,2
最高人民法院关于行政诉讼证据若干问题的规定,第四十八条,"　对被诉具体行政行为涉及的专门性问题，当事人可以向法庭申请由专业人员出庭进行说明，法庭也可以通知专业人员出庭说明。必要时，法庭可以组织专业人员进行对质。 
　　当事人对出庭的专业人员是否具备相应专业知识、学历、资历等专业资格等有异议的，可以进行询问。由法庭决定其是否可以作为专业人员出庭。 
　　专业人员可以对鉴定人进行询问。",现行有效,司法解释,高法司法解释,中央,20021001,99999999,中央,https://ydzk.chineselaw.com/zxt/statuteDetail/detailPage/cec5dfff41c2a23b429b09bd95aa445e?text=48,cec5dfff41c2a23b429b09bd95aa445e_48,cec5dfff41c2a23b429b09bd95aa445e,[],0.9972072,1
最高人民检察院关于印发最高人民检察院第三十八批指导性案例的通知,,"司法实践中，检察机关对鉴定意见应当重点审查以下内容：鉴定机构或鉴定人是否具有法定鉴定资质；检材是否经各方当事人质证；鉴定人对当事人提出的异议是否答复以及答复是否合理；对合理异议鉴定机构是否作出补充鉴定意见；鉴定人是否对鉴定使用的标准和方法作出说明；鉴定人是否出庭答疑；鉴定人出具的鉴定意见与法院委托鉴定的范围、方式是否相符等。特别是在经过多次鉴定且鉴定意见存在冲突的情形下，检察机关应当统筹考虑鉴定内容、鉴定程序、鉴定资质以及当事人在关键节点能否充分行使诉权等因素，并结合案件其他证据，综合判断鉴定意见是否可以采信，防止出现“以鉴代审”的情况。　　【相关规定】
　　《中华人民共和国民法典》第六百六十七条、第六百七十五条（本案适用的是《中华人民共和国合同法》第一百九十六条、第二百零六条）
　　《中华人民共和国民事诉讼法》（2017年修正）第二百零八条、第二百零九条（现为2021年修正后的第二百一十五条、第二百一十六条）
　　《人民检察院民事诉讼监督规则（试行）》（2013年施行）第四十七条、第九十一条（现为2021年施行的《人民检察院民事诉讼监督规则》第四十三条、第九十条）",现行有效,司法解释,指导案例,,20220628,99999999,中央,https://ydzk.chineselaw.com/zxt/statuteDetail/detailPage/6dcd45e1f0a33c427cf9c61df78d30a8,,6dcd45e1f0a33c427cf9c61df78d30a8,[],0.96949884,2
最高人民法院关于民事诉讼证据的若干规定(2019修正),第八十一条,"　鉴定人拒不出庭作证的，鉴定意见不得作为认定案件事实的根据。人民法院应当建议有关主管部门或者组织对拒不出庭作证的鉴定人予以处罚。 
　　当事人要求退还鉴定费用的，人民法院应当在三日内作出裁定，责令鉴定人退还；拒不退还的，由人民法院依法执行。 
　　当事人因鉴定人拒不出庭作证申请重新鉴定的，人民法院应当准许。",现行有效,司法解释,高法司法解释,中央,20200501,99999999,中央,https://ydzk.chineselaw.com/zxt/statuteDetail/detailPage/21d0c4b7c7833b78c7217600f2be8693?text=81,21d0c4b7c7833b78c7217600f2be8693_81,21d0c4b7c7833b78c7217600f2be8693,"['财税##司法及单行法律专题法规##法院', '财税##司法及单行法律专题法规', '财税']",0.9407861999999999,1
